[
    {
        "artist": "Estelle",
        "song": "American Boy ft. Kanye West",
        "line": "Look at this pea coat, tell me he’s broke",
        "genius_link": "https://genius.com/91238"
    },
    {
        "artist": "Tinie Tempah",
        "song": "Pass Out",
        "line": "Now I drive past the bus I used to run for",
        "genius_link": "https://genius.com/Tinie-tempah-pass-out-lyrics"
    },
    {
        "artist": "Kanye West",
        "song": "Junya",
        "line": "I won with the bucks, boy, let me Giannis",
        "genius_link": "https://genius.com/23571738"
    },
    {
        "artist": "The Weeknd",
        "song": "Sidewalks ft. Kendrick Lamar",
        "line": "Grew up with no father so nobody ever son me",
        "genius_link": "https://genius.com/10897433"
    },
    {
        "artist": "The Weeknd",
        "song": "Tell Your Friends",
        "line": "Cruise through the west–end in my new Benz, I’m just tryna live life through a new lens",
        "genius_link": "https://genius.com/7659455"
    },
    {
        "artist": "Lupe Fiasco",
        "song": "The Show Goes On",
        "line": "I was once that little boy, Terrified of the world, now I’m on a world tour",
        "genius_link": "https://genius.com/15947465/Lupe-fiasco-the-show-goes-on/Yeah-yeah-the-world-is-yours-i-was-once-that-little-boy-terrified-of-the-world-now-im-on-a-world-tour"
    },
    {
        "artist": "Consequence",
        "song": "Grammy Family ft. Kanye West, DJ Khaled, John Legend",
        "line": "Hi haters I’m back off hiatus, I feel just like you, I mean even I hate us",
        "genius_link": "https://genius.com/Consequence-grammy-family-lyrics"
    },
    {
        "artist": "Jay Z",
        "song": "U Don’t Know",
        "line": "Put me anywhere on God’s green earth,  I’ll triple my worth",
        "genius_link": "https://genius.com/381141"
    }
]