[
    {
        "artist": "Estelle",
        "song": "American Boy ft. Kanye West",
        "line": "Look at this pea coat, tell me he's broke",
        "genius_link": "https://genius.com/91238"
    },
    {
        "artist": "Tinie Tempah",
        "song": "Pass Out",
        "line": "Now I drive past the bus I used to run for",
        "genius_link": "https://genius.com/Tinie-tempah-pass-out-lyrics"
    },
    {
        "artist": "Kanye West",
        "song": "Junya",
        "line": "I won with the bucks, boy // Let me Giannis // I won with the bucks, boy // The spirit is on us",
        "genius_link": "https://genius.com/23571738"
    },
    {
        "artist": "The Weeknd",
        "song": "Sidewalks ft. Kendrick Lamar",
        "line": "Grew up with no father so nobody ever \"son\" me",
        "genius_link": "https://genius.com/10897433"
    },
    {
        "artist": "The Weeknd",
        "song": "Tell Your Friends",
        "line": "Cruise through the westâ€“end in my new Benz // I'm just tryna live life through a new lens",
        "genius_link": "https://genius.com/7659455"
    },
    {
        "artist": "Lupe Fiasco",
        "song": "The Show Goes On",
        "line": "Yeah, yeah, the world is yours, I was once that little boy // Terrified of the world, now I'm on a world tour",
        "genius_link": "https://genius.com/15947465/Lupe-fiasco-the-show-goes-on/Yeah-yeah-the-world-is-yours-i-was-once-that-little-boy-terrified-of-the-world-now-im-on-a-world-tour"
    }
]